{
  "schemaVersion": "f0.normalized.v1",
  "kind": "occurrence",
  "id": "gbif:5938033634",
  "taxon": { "source": "GBIF", "id": "5163063", "scientificName": "Takahashia japonica (Cockerell, 1896)", "kingdom": "Animalia", "rank": "SPECIES", "status": "ACCEPTED" },
  "provenance": {
    "provider": "GBIF",
    "dataset": "iNaturalist research-grade observations",
    "sourceVersion": "GBIF occurrence index 2026-09",
    "retrievedAt": "2026-09-14T12:36:46Z",
    "sourceRecordId": "5938033634",
    "queryId": "gbif-occurrence-parco-nord-v1",
    "sourceUrl": "https://www.inaturalist.org/observations/333159766",
    "license": "http://creativecommons.org/licenses/by-nc/4.0/legalcode",
    "attribution": "iNaturalist research-grade observations; GBIF occurrence 5938033634",
    "quality": "medium",
    "rawFixture": "fixtures/providers/gbif-occurrence.parco-nord.json"
  },
  "data": {
    "occurrenceStatus": "PRESENT",
    "observedAt": "2026-01-02T13:47",
    "position": { "latitude": 45.530011, "longitude": 9.20274, "crs": "EPSG:4326" },
    "coordinateUncertaintyM": 800,
    "basisOfRecord": "HUMAN_OBSERVATION",
    "issues": ["COORDINATE_ROUNDED", "CONTINENT_DERIVED_FROM_COORDINATES", "TAXON_ID_NOT_FOUND"]
  }
}
